{
  "digest_version": "1.0.0",
  "schema_version": "1.1.0",
  "package": "abap_fico",
  "source_system": "bundle:demos/abap_fico-acceptance-2026-07-27/before/source",
  "source_hash": "3f615aea7e991102f5c719f4ac9ab38c89c06fe4a278ef3c488802bb4e76d334",
  "config_hash": "b1005522ed1354d57f1872127514cf349ea35aa604e5fd3e742fa5b9c28bf7d9",
  "run_id": "48d54dd28da97fcee66f14ed6da9f897f41ab7d11ee283a70f6df06d25ce26d9",
  "object_count": 31,
  "objects_included": 31,
  "finding_count": 879,
  "findings_included": 200,
  "objects": [
    {
      "object": "ZFICO_BTC_CSV_SCR",
      "grade": "unknown",
      "effort_tier": "unknown"
    },
    {
      "object": "ZFICO_BTC_CSV_TOP",
      "grade": "unknown",
      "effort_tier": "unknown"
    },
    {
      "object": "ZCREATE_ASSET",
      "grade": "unknown",
      "effort_tier": "unknown"
    },
    {
      "object": "ZFICO_BTC_CSV_GL",
      "grade": "D",
      "effort_tier": "unknown"
    },
    {
      "object": "ZFICO_FUNCTIONS",
      "grade": "unknown",
      "effort_tier": "unknown"
    },
    {
      "object": "ZFI_BTE",
      "grade": "D",
      "effort_tier": "unknown"
    },
    {
      "object": "ZFI_C0001",
      "grade": "unknown",
      "effort_tier": "unknown"
    },
    {
      "object": "ZFI_C0002",
      "grade": "unknown",
      "effort_tier": "unknown"
    },
    {
      "object": "ZFI_FIELDSTATUS_ANALYZE",
      "grade": "D",
      "effort_tier": "unknown"
    },
    {
      "object": "ZFI_RGGBR000",
      "grade": "unknown",
      "effort_tier": "unknown"
    },
    {
      "object": "ZFI_RGGBS000",
      "grade": "D",
      "effort_tier": "unknown"
    },
    {
      "object": "KD_GET_FILENAME_ON_F4",
      "grade": "unknown",
      "effort_tier": "unknown"
    },
    {
      "object": "LFB1",
      "grade": "D",
      "successor": "I_SUPPLIERCOMPANY",
      "effort_tier": "retire"
    },
    {
      "object": "T856",
      "grade": "unknown",
      "effort_tier": "unknown"
    },
    {
      "object": "SKB1",
      "grade": "D",
      "successor": "I_GLACCOUNTINCOMPANYCODE",
      "effort_tier": "retire"
    },
    {
      "object": "CONVERT_DATE_TO_EXTERNAL",
      "grade": "unknown",
      "effort_tier": "unknown"
    },
    {
      "object": "GET_PRINT_PARAMETERS",
      "grade": "unknown",
      "effort_tier": "unknown"
    },
    {
      "object": "KNA1",
      "grade": "D",
      "successor": "I_CUSTOMER",
      "effort_tier": "retire"
    },
    {
      "object": "KNB1",
      "grade": "D",
      "successor": "I_CUSTOMERCOMPANY",
      "effort_tier": "retire"
    },
    {
      "object": "LFA1",
      "grade": "D",
      "successor": "I_SUPPLIER",
      "effort_tier": "retire"
    },
    {
      "object": "ANLA",
      "grade": "unknown",
      "effort_tier": "unknown"
    },
    {
      "object": "BAPI_FIXEDASSET_CREATE1",
      "grade": "unknown",
      "effort_tier": "unknown"
    },
    {
      "object": "T001",
      "grade": "D",
      "successor": "I_COMPANYCODE",
      "effort_tier": "retire"
    },
    {
      "object": "T004F",
      "grade": "unknown",
      "effort_tier": "unknown"
    },
    {
      "object": "TBSL",
      "grade": "D",
      "successor": "I_POSTINGKEY",
      "effort_tier": "retire"
    },
    {
      "object": "TMODF",
      "grade": "unknown",
      "effort_tier": "unknown"
    },
    {
      "object": "POPUP_TO_INFORM",
      "grade": "unknown",
      "effort_tier": "unknown"
    },
    {
      "object": "POSTING_INTERFACE_DOCUMENT",
      "grade": "unknown",
      "effort_tier": "unknown"
    },
    {
      "object": "POSTING_INTERFACE_END",
      "grade": "unknown",
      "effort_tier": "unknown"
    },
    {
      "object": "POSTING_INTERFACE_START",
      "grade": "unknown",
      "effort_tier": "unknown"
    },
    {
      "object": "SKA1",
      "grade": "D",
      "successor": "I_GLACCOUNTINCHARTOFACCOUNTS",
      "effort_tier": "retire"
    }
  ],
  "findings": [
    {
      "object": "ZCREATE_ASSET",
      "rule_id": "talos-cloud-001-call-function",
      "severity": "priority-1",
      "family": "clean-core",
      "message": "CALL FUNCTION is forbidden in generated ABAP Cloud code — use a released API method call (CLOUD-001)."
    },
    {
      "object": "ZCREATE_ASSET",
      "rule_id": "talos-cloud-015-salv-table-factory",
      "severity": "priority-1",
      "family": "deprecation",
      "message": "CL_SALV_TABLE=>factory is the classic ALV stack — not released in ABAP Cloud; use Fiori Elements (CLOUD-015)."
    },
    {
      "object": "ZCREATE_ASSET",
      "rule_id": "talos-perf01-select-star-projection",
      "severity": "priority-1",
      "family": "performance",
      "message": "SELECT * (incl. SELECT SINGLE *) fetches all columns; use an explicit field list or a projecting CDS view."
    },
    {
      "object": "ZFICO_BTC_CSV_GL",
      "rule_id": "released-api",
      "severity": "priority-1",
      "family": "released-api",
      "message": "uses SKA1 (notToBeReleased) — not released for ABAP Cloud; released successor I_GLACCOUNTINCHARTOFACCOUNTS"
    },
    {
      "object": "ZFICO_BTC_CSV_GL",
      "rule_id": "released-api",
      "severity": "priority-1",
      "family": "released-api",
      "message": "uses SKB1 (notToBeReleased) — not released for ABAP Cloud; released successor I_GLACCOUNTINCOMPANYCODE"
    },
    {
      "object": "ZFICO_BTC_CSV_GL",
      "rule_id": "talos-cloud-001-call-function",
      "severity": "priority-1",
      "family": "clean-core",
      "message": "CALL FUNCTION is forbidden in generated ABAP Cloud code — use a released API method call (CLOUD-001)."
    },
    {
      "object": "ZFICO_BTC_CSV_GL",
      "rule_id": "talos-cloud-001-call-function",
      "severity": "priority-1",
      "family": "clean-core",
      "message": "CALL FUNCTION is forbidden in generated ABAP Cloud code — use a released API method call (CLOUD-001)."
    },
    {
      "object": "ZFICO_BTC_CSV_GL",
      "rule_id": "talos-cloud-001-call-function",
      "severity": "priority-1",
      "family": "clean-core",
      "message": "CALL FUNCTION is forbidden in generated ABAP Cloud code — use a released API method call (CLOUD-001)."
    },
    {
      "object": "ZFICO_BTC_CSV_GL",
      "rule_id": "talos-cloud-001-call-function",
      "severity": "priority-1",
      "family": "clean-core",
      "message": "CALL FUNCTION is forbidden in generated ABAP Cloud code — use a released API method call (CLOUD-001)."
    },
    {
      "object": "ZFICO_BTC_CSV_GL",
      "rule_id": "talos-cloud-002-tables-param",
      "severity": "priority-1",
      "family": "clean-core",
      "message": "TABLES parameters are a compile error in ABAP Cloud — use IMPORTING/EXPORTING/CHANGING TYPE TABLE OF (CLOUD-002)."
    },
    {
      "object": "ZFICO_BTC_CSV_GL",
      "rule_id": "talos-cloud-006-write",
      "severity": "priority-1",
      "family": "deprecation",
      "message": "WRITE requires the classic list processor — forbidden in ABAP Cloud; use RAP/Fiori for output (CLOUD-006)."
    },
    {
      "object": "ZFICO_BTC_CSV_GL",
      "rule_id": "talos-cloud-006-write",
      "severity": "priority-1",
      "family": "deprecation",
      "message": "WRITE requires the classic list processor — forbidden in ABAP Cloud; use RAP/Fiori for output (CLOUD-006)."
    },
    {
      "object": "ZFICO_BTC_CSV_GL",
      "rule_id": "talos-cloud-006-write",
      "severity": "priority-1",
      "family": "deprecation",
      "message": "WRITE requires the classic list processor — forbidden in ABAP Cloud; use RAP/Fiori for output (CLOUD-006)."
    },
    {
      "object": "ZFICO_BTC_CSV_GL",
      "rule_id": "talos-cloud-006-write",
      "severity": "priority-1",
      "family": "deprecation",
      "message": "WRITE requires the classic list processor — forbidden in ABAP Cloud; use RAP/Fiori for output (CLOUD-006)."
    },
    {
      "object": "ZFICO_BTC_CSV_GL",
      "rule_id": "talos-cloud-006-write",
      "severity": "priority-1",
      "family": "deprecation",
      "message": "WRITE requires the classic list processor — forbidden in ABAP Cloud; use RAP/Fiori for output (CLOUD-006)."
    },
    {
      "object": "ZFICO_BTC_CSV_GL",
      "rule_id": "talos-perf01-select-star-projection",
      "severity": "priority-1",
      "family": "performance",
      "message": "SELECT * (incl. SELECT SINGLE *) fetches all columns; use an explicit field list or a projecting CDS view."
    },
    {
      "object": "ZFICO_BTC_CSV_GL",
      "rule_id": "talos-perf01-select-star-projection",
      "severity": "priority-1",
      "family": "performance",
      "message": "SELECT * (incl. SELECT SINGLE *) fetches all columns; use an explicit field list or a projecting CDS view."
    },
    {
      "object": "ZFICO_BTC_CSV_GL",
      "rule_id": "talos-select-in-loop",
      "severity": "priority-1",
      "family": "performance",
      "message": "SELECT inside LOOP causes N+1 database round-trips; batch-read before the loop (ABAP-N1)"
    },
    {
      "object": "ZFICO_BTC_CSV_GL",
      "rule_id": "talos-select-in-loop",
      "severity": "priority-1",
      "family": "performance",
      "message": "SELECT inside LOOP causes N+1 database round-trips; batch-read before the loop (ABAP-N1)"
    },
    {
      "object": "ZFICO_BTC_CSV_GL",
      "rule_id": "talos-select-in-loop",
      "severity": "priority-1",
      "family": "performance",
      "message": "SELECT inside LOOP causes N+1 database round-trips; batch-read before the loop (ABAP-N1)"
    },
    {
      "object": "ZFICO_BTC_CSV_GL",
      "rule_id": "talos-select-in-loop",
      "severity": "priority-1",
      "family": "performance",
      "message": "SELECT inside LOOP causes N+1 database round-trips; batch-read before the loop (ABAP-N1)"
    },
    {
      "object": "ZFICO_BTC_CSV_GL",
      "rule_id": "talos-select-in-loop",
      "severity": "priority-1",
      "family": "performance",